{
  "schemaVersion": 1,
  "configRevision": 1,
  "deviceId": "GATE-CR-0004",
  "placeName": "Caseta solo relays",
  "api": {
    "baseUrl": "https://app.aditumcr.com/api"
  },
  "scannerType": "none",
  "scanners": [],
  "screen": { "hasScreen": false },
  "gpio": {
    "enabled": true,
    "mode": "BOARD",
    "gates": [
      { "id": 1, "pin": 7, "linkedGates": [ { "gateId": 2, "delaySeconds": 3 } ] },
      { "id": 2, "pin": 11 },
      { "id": 3, "pin": 12 },
      { "id": 4, "pin": 13, "normallyOpen": false }
    ],
    "pulseSeconds": 1,
    "neopixel": { "enabled": false },
    "watchdog": { "enabled": true, "host": "1.1.1.1", "intervalSec": 240 }
  },
  "hikvision": { "enabled": false },
  "polling": { "intervalSeconds": 60, "enabled": false }
}
