{
  "schemaVersion": 1,
  "configRevision": 0,
  "deviceId": "",
  "placeName": "Sin configurar",
  "api": {
    "baseUrl": "https://app.aditumcr.com/api",
    "verifierStyle": "secure"
  },
  "scannerType": "none",
  "scanners": [],
  "screen": { "hasScreen": false },
  "gpio": {
    "enabled": true,
    "mode": "BOARD",
    "gates": [
      { "id": 1, "pin": 7 },
      { "id": 2, "pin": 11 },
      { "id": 3, "pin": 12 },
      { "id": 4, "pin": 13 },
      { "id": 5, "pin": 15 },
      { "id": 6, "pin": 16 },
      { "id": 7, "pin": 18 },
      { "id": 8, "pin": 22 },
      { "id": 9, "pin": 29 },
      { "id": 10, "pin": 35 }
    ],
    "pulseSeconds": 1,
    "neopixel": { "enabled": false, "pin": "D18", "count": 55 },
    "watchdog": { "enabled": false, "host": "1.1.1.1", "intervalSec": 240 }
  },
  "hikvision": { "enabled": false, "nightlyCleanupHour": 2 },
  "anpr": { "enabled": false },
  "polling": { "intervalSeconds": 60, "enabled": false }
}
